text,label
بالفيديو خريجات التربية يروين معاناتهن إحداهن عملت في محل للحلويات وأخرى عاطلة وهي تحمل الماجستير,0
في انتظار التسليم مرحبا الحزمة الخاصة بك التي تحتوي على رمز التتبع في انتظارك لتأكيد عنوان الشحنة,1
هذه هدية للتعبير عن امتناننا لسجل الدفع الاستثنائي الخاص بك عيد ميلاد مجيد تي موبايل,1
تم قفل الحساب بسبب نشاط غير عادي سيظل بإمكانك إيداع الأموال في حسابك حساباتك في تفضل بزيارة الرابط لإزالة التعليق,1
عرض نهاية الأسبوع الخيالي اشتري واحصلي على مجانا من العطور,0
عزيزي العميل نحيطك علما إلى أنه تم تخصيص خدمة خاصة بالإبلاغ عن الرسائل الاحتيالية لذا نود منكم عند استلام رسائل تطلب بياناتكم البنكية لتحديثها أو تقوم بإعطاء وعود بالفوز بمكافئات الإبلاغ عنها وذلك من خلال إرسال الأرقام الواردة في الرسالة مع رقم المرسل الى الرقم,0
تطبيق الجوال كلمة السر للدخول,0
نود أن نلفت عنايتكم إلى إن فعالية الألعاب النارية المصاحبة لموسم الرياض سيتم إطلاقها اليوم الخميس الموافق م في تمام الساعة مساء ولمدة دقائق من برج الفيصلية برج المملكة ومنطقة البوليفارد عليه نأمل توخي الحيطة والحذر علما أن السرعة المقترحة خلال فترة العرض بالطرق المحيطة كمالساعة,0
حوالة واردةمحليةعبر الىمبلغ في,0
تنبيه جميع الأموال معلقة بسبب الودائع المباشرة المتعددة الاحتيالية وستظل الودائع المباشرة المتبقية معلقة قم بزيارة لإزالة التعليق,1
مركز بوابة المنطق للتدريب يعلن عن إقامة أساسيات صيانة الجوال في نسختها السادسة التفاصيل أقوى برنامج تدريب دورة أساسيات صيانة الجوال بالطائف بواقع ساعة و أيام بشهادة معتمدة من المؤسسة العامة للتدريب التقني والمهني رقم الاعتماد شروط التسجيل أن يكون المتدرب حاصل على الاقل شهادة المتوسط رابط التسجيل,0
إشعار حساس للوقت هل تتعرض لمياه غير آمنة إذا كنت أنت أو أي شخص تحبه متمركزا أو عملت أو عشت لمدة يوما على الأقل في قبل عام فقد يحق لك الحصول على تعويض كبير احصل على استشارة الخاصة بك عن طريق الاتصال بالرقم,1
الآن مع عروضنا لك وبين يديك اشحن رصيدك واسترجع من قيمة الشحن في محفظتك من خلال تطبيق طريقة شحن سوا تطبق الشروط والأحكام حمل التطبيق الآن,0
مستخدم الكمبيوتر أرسل لك دعوة للدردشة قبول أدناه,1
عميلنا العزيزارسل إلى لتحصل على أيام اشتراك مجاني في تطبيق جوي تي في مع بيانات لامحدودة على التطبيق لأول ثلاثة أشهراستمتع بمشاهدة القنوات التلفزيونية المجانية والمشفرة وأحدث الأفلام والمسلسلات إلى جانب الأفلام الوثائقية وبرامج الأطفال في أي زمان وأي مكانعلما بأن سعر الاشتراك بعد الفترة المجانية هي ريال شهريا فقطتحق الفترة المجاني للعملاء الجدد فقط وسعر الاشتراك بعد أشهر ريال شهري,0
خدمة بريد السعودي تحتوي الحزمة الخاصة بك على عنوان إعادة توجيه خاطئ وتم تعليقها مؤقتا الرجاء الرد على موافق واتخاذ الخطوات اللازمة لإعادة تنشيطه,1
عزيزي العميلوعيك أداة حمايتكفي حال وصلتك رسائل من أرقام غير معروفة تطلب تحديث بياناتك البنكية أو تعلن عن الفوز بجوائز وهمية فاحرص على عدم التجاوب معها والإبلاغ عنها من خلال إعادة إرسال الرسالة للرقم المخصص للإبلاغ عن الرسائل الاحتيالية,0
تحياتي لعملاء أمازون بموجب لائحة جديدة لأمازون نحتاج إلى أن نطلب من عملائنا تحديث معلومات حساباتهم من أجل الاستمرار في استخدام التسوق على أمازون قم بالتحديث هنا إذا لم يقم العميل بتحديث معلومات الحساب خلال ال ساعة القادمة فسيتم إغلاق حسابك على أمازون نهائيا معرف أمازون,1
لقد قمنا بتعليق خدمة الخاصة بك مؤقتا لاستعادة اتبع التعليمات أدناه يرجى إكمال عملية الاسترداد خلال يومين وإلا فسيتم تعليق حساب أمازون نهائيا نحن نأسف على أي إزعاج قد يكون سببه هذا الأمر شكرا لكم على اهتمامكم,1
لقد عرضت عليك منحة بقيمة ريال سعودي يرجى الاتصال بفرانسيس باتريك كونولي مع الرقم المرجع,1
خلك الفائز ال عشر مشتركين فازوا ب سبائك ذهب والفرصة لك لتفوز بأحدى سبيكة ذهبية وكيلو من الذهب عملاء سوا بوست وسوا ستار يدخلون تلقائيا للسحب على الذهب تقدر تعرف أكثر إذا أرسلت سوا سوشل إلى العرض يسري حتى ديسمبر م وتقدر تشوف فيديو السحب الأخير من خلال الرابط,0
تهانينا تي موبايل لقد تم اختيارك للحصول على مكافأة حصرية انقر فوق موافق للبدء,1
عزيزي أنت مدعو للانضمام إلى مجموعة المناقشة الداخلية البيتكوين سيقوم الفريق بنشر يوميا كيفية تحقيق الربح في سوق البيتكوين قم بالرد على الرقم ثم اضغط على الرابط للانضمام ديجي,1
مرحبا حبينا نبلغك أننا عدلنا مدة الصلاحية للرصيد والشريحة مدة الصلاحية للرصيد بتكون يوم وللشريحة سنة كاملة تتمدد صلاحية الرصيد والشريحة عن طريق استخدامك الغير مجاني للرصيد مثل الاشتراك بأحد باقاتنا إجراء مكالمة أو إرسال رسالة ونذكرك أنك ما استخدمت رصيدك أو أعدت الشحن من يوم,0
أسعار التجوال الدولي في تونس بالريال السعودي الاتصال المحلي الاتصال إلى السعودية الاتصال الدولي استقبال المكالمة الرسالة النصية البيانات لكل ميجابايت,0
تم تعليق الحساب بسبب اختراق قاعدة البيانات مؤخرا لأسباب تتعلق بالسلامة انقر فوق لإعادة التنشيط,1
العربية للعود ترحب بكم في برنامج تواصل رمز التفعيل,0
لاسترداد مبلغ ريالا سعوديا نحتاج إلى تأكيدك قم بتصديقها من خلال نظام التحقق عبر الإنترنت الخاص بنا,1
السلام عليكم ورحمة الله وبركاته الإخوة والأخوات الباحثين والباحثات عن عمل نرجو التكرم بملء الاستبيان في الرابط أدناه قبل يوم الأحد مارس ونرجو الاجابة بدقة على أسئلة الاستبيان للوصول إلى نتائج بحثية دقيقة عنوان البحث البطالة وتحدياتها في ضوء رؤية المملكة يهدف البحث لتحديد تحديات البطالة التي تواجه الشباب والشابات في المملكة العربية السعودية وإيجاد الحلول المناسبة لها شاكرين لكم كرم استجابتكم,0
كلمة مرور صالحة لمرة واحدةرمز ل تنشيط الفواتير تطبيق المباشر,0
إن الأبرار لفي نعيم وإن الفجار لفي جحيم لا تظن أن هذه الآية تختص بيوم المعاد فقط بل هؤلاء في نعيم في دورهم الثلاثة الدنيا والبرزخ والآخرة وأولئك في جحيم في دورهم الثلاثة وأي لذة ونعيم في الدنيا أطيب من بر القلب وسلامة الصدر ومعرفة الرب تعالى ومحبته والعمل على موافقتهصلواعلى الحبيب ربي إرحمهماكماربياني صغيرا,0
عزيزنا العميلنشعركم بأنه يوجد لديكم شحنة برقم يمكنكم استلامها من طبرجل التسليم,0
هام لقد حان موعد سداد الدفعة الخاصة بك الآن لإجراء الدفع انقر فوق أو اطلب من هاتفك,1
نعتذر عن انقطاع الهاتف المؤقت يوم أمس لقد كنت واحدا من عميل متأثر وفي المقابل نقدم لك هدية مجانية بقيمة ريال يرجى المشاركة في هذا الاستطلاع الموجز لمدة ثانية حول وسنقدم لك عنصرا مجانيا بقيمة ريال,1
عزيزي العميل أرسل الى واحصل على تطبيق جوي ب ريال لمدة ثلاث شهور وقم بمشاهدة مع بيانات لامحدوده على التطبيق مجانا اشترك الان وأول أيام مجانا للعملاء الجدد هذا العرض متاح لك فقط حتى تاريخ,0
عزيزي المستخدم لقد تلقى هاتفك عددا كبيرا جدا من رسائل البريد العشوائي اقض عليهم الآن هنا,1
الموضوع تم اكتشاف تسجيل دخول جديد من عمان اتبع الرابط أدناه لفتح حسابك قم بالتحقق من حسابك خلال ساعة وإلا سيتم إنهاء حساب الخاص بك نهائيا مع تحياتي معرف باي بال,1
لقد تم اختراق هاتفك انقر فوق الرابط أدناه لإزالة,1
لقد تم تعطيل خصم الخاص بك مؤقتا ارجع إلى قم بالرد على لإلغاء الاشتراك,1
قيم الخدمات الحكومية وساهم في بناء الوطنحمل تطبيق وطني الآن صوت فاعل لوطن عامر,0
جيجا ومكالمات لا محدودة مع سوا شير استمتع ب جيجا انترنت بالإضافة إلى جيجا لمواقع التواصل الاجتماعي ومكالمات لامحدودة داخل الشبكة كل هذا ب ريال فقط للاشتراك أرسل إلى لمعرفة المزيد عن باقات سوا أرسل إلى,0
خصم من حسابك في مدفوعات سوا,0
حصريا للموقع وليوم واحد فقط اشتري اونلاين واحصل على استرجاع نقدي اضافي على اي عرض,0
تنبيهات تم وضع الإيداع المباشر في حسابك قيد المراجعة يرجى زيارة لحل هذه المشكلة,1
عزيزي العميلعند عزمك على الاكتتاب أو الاستثمار في أسواق الأسهم والأوراق المالية احرص على التعامل مع الجهات الرسمية والمرخصة واحذر من التجاوب مع الرسائل والإعلانات على شبكة الإنترنت من شركات غير مرخصة والتي تعطيك الوعود الوهمية بالربح السريع,0
لقد تم قفل حساب أمازون الخاص بك لقد تلقينا مؤخرا عدة محاولات فاشلة لتسجيل الدخول إلى حسابك قم باسترداد حسابك على الفور انقر فوق الرابط أدناه يرجى اتخاذ إجراء بشأن حسابك في غضون ساعة لتجنب التعليق الدائم مع تحيات خدمة أمازون,1
كلمة مرور صالحة لمرة واحدةرمز ل المدفوعات الحكومية تطبيق المباشر في,0
الطرد الخاص بك والذي يتضمن المنتجات التالية لا يمكن الموافقة على التسليم في انتظار سداد رصيد الضريبة المستحق الرصيد الحالي المستحق ريال معلومات إضافية,1
تحديث مهم بقي لديك ساعة لحجز جهاز الذي فزت به في سبتمبر,1
تطبيق الجوال كلمة السر للسوق الالكتروني,0
تبي تريح بالك من المكالمات وترد على اللي تبي بدون إحراجات مع موجود إكسترا تقدر تحول مكالماتك ويظهر للمتصل إن جوالك مقفل وراح يجيك تنبيه بمعلومات المتصلين للاشتراك أرسل إلى للإلغاء أرسل إلى قيمة الاشتراك ريال شهريا,0
الحصول على أموال يستغرق دقيقتين فقط,1
هل تريد صنع جبنة إضافية أجب عن هذه الأسئلة وستمنحك مبلغا رائعا قدره ريالا قم بدعوة صديق واحصل على فرصة لكسب المزيد,1
خصم على جميع رحلاتكالسفر معنا ما يتفوت احجز رحلتك مع تطبيق المطار وسدد من خلال واستمتع بخصم على رحلتك حمل الآن صالح حتى,0
تنبيه تم تسجيل حساب الخاص بك للتو في جهاز جديد إذا لم يكن هذا هو الحال فيرجى النقر هنا لاستعادة إمكانية الوصول أو زيارة الفرع القريب,1
عزيزي لقد اجتزت المقابلة يمكن استلام ما متوسطه يوميا تواصل مع صباحا,1
شكرا على الشراء تم تحصيل مبلغ ريالا سعوديا على بطاقتك معرف طلب بتاريخ فبراير ليس أنت اتصل بنا,1
عرض اليوم الخاصأرسل إلى واحصل على مجانا أيام اشتراك من تطبيق جوي تي في مجانا بيانات لامحدودة على التطبيق لمدة أشهر مجانا جيجا بايت لمدة أيامقيمة الاشتراك في جوي تي في بعد الفترة المجانية ريال شهريا ويمكن إلغاء الاشتراك في أي وقت عن طريق تطبيق ستضاف جيجا بايت بعد ساعة من الاشتراك,0
نرحب بكم ببرنامج تواصللتفعيل حسابكم والاستفادة من النقاط لدى العربية للعود يرجى التكرم بتعبئة البيانات في,0
من أسباب زوال الهموم وغفران الذنوب الصلاة على النبي ويوم الجمعة يكون أثر الصلاة أعظم قال النبي للمصلي عليه تكفى همك ويغفر لك ذنبك,0
عزيزالعميل تم حظر بطاقة بك لأنك لا تملك التحديث بهذا الرقم على الفور للتحديث,1
متى يجب لبس الكمامةإذا كنت مصابا بالسعال أو العطاسإذا كنت تعتني بشخص مريض بأعراض تنفسية وفي الرابط بقية الوصايا الخاصة بفيروس كورونا تحياتوزارة الصحة,0
لا يمكن تسليم الطرد الخاص بك بسبب رقم المنزل غير الصحيح يرجى ملء العنوان الصحيح عبر الإنترنت لإعادة التسليم,1
عزيزي العميل اشترك في باقات التجوال للإنترنت في تونس على شبكة باقة جيجا لمدة يوم بقيمة ريال الرمز باقة جيجا لمدة أسبوع بقيمة ريال الرمز باقة جيجا لمدة شهر بقيمة ريال الرمز للاشتراك يرجى ارسال رمز الباقة الى و لمعرفة الدول والشبكات التي تشملها الباقة ارسل إلى ولباقات التجوال للمكالمات ارسل الى علما بأن بإمكانكم استخدام تطبيق مجانا اثناء التجوال,0
مجانا بمناسبة اليوم الوطني أرسل إلى و فعل اشتراكك في تطبيق جوي تي في لمدة يوم بدون أي رسومهمةحتىالقمةيسري العرض حتى سبتمبر لمن لم يسبق له الاشتراك في جوي تي في,0
توفيرك صار أكثر مع سوا لايك دقيقة داخل الشبكة جيجا لشبكات التواصل الاجتماعي جيجا انترنت جيجا انترنت على شبكة سعر الباقة ريال بس للإشتراك أرسل الى صلاحية الباقة اسابيع وإذا تبي تعرف معلومات أكثر عن باقات سوا التوفيرية أرسل إلى,0
مرحبا أنت مدعو لحضور حدث يرجى التحقق من بريدك الإلكتروني للحصول على التفاصيل أو الرد على الدعوة على,1
نشاط غير عادي لقد قمنا بتعليق حسابك في أمازون بسبب نشاط غير عادي تم حظر محاولة تسجيل الدخول من كندا قام نظامنا بتعليق حسابك في لأسباب أمنية لإلغاء قفل حسابك في يرجى التحقق من خلال الرابط أدناه يتعين عليك اتخاذ الإجراء خلال يومين قبل تعليق الحساب مع تحياتي فرق أمازون,1
أناقة بأفضل الأسعار من مهيار أثواب بيضاء ب فقط تشكيلة مختارة,0
لقد قمنا بحظر حسابك بسبب نشاط غير عادي يرجى زيارة للتحقق من حسابك,1
عميلنا العزيز لقد استنفذت كامل باقة البيانات لعرض الهوية الجديدة جيجا بيانات إضافية,0
عزيزي العميلبقيمة ريال اشترك الان في باقة تجوال دول العالم في الأردن على الشبكات التاليةلمدة أسبوعين تحصل على مكالمات للسعودية بريال واحد للدقيقة مكالمات داخل الأردن بريال واحد للدقيقة استقبال المكالمات بريال واحد للدقيقة انترنت تجوال جيجابايتللاشتراك يرجى ارسال الى علما بأن بإمكانكم استخدام تطبيق مجانا اثناء التجوال,0
ما عندك وقت تروح تشتري بطاقة شحن بسيطة تقدر تشحن وتجدول شحن رصيدك بشكل أسبوعي أو خلال يوم محدد في الشهر باستخدام بطاقتك الائتمانية أو بطاقة مدى مع تطبيق ما عليك إلا تحمل التطبيق وتفعل الخدمة للتحميل اضغط على الرابط,0
باقات إنترنت التجوال في تونس جيجا يوم واحد ريال الرمز جيجا ايام ريال الرمز جيجا يوم ريال الرمز للاشتراك أرسل رمز الباقة إلى هذه الباقات تعمل على الشبكات التالية يمكنك معرفة الدول التي تشملها الباقات عند السفر لأكثر من دولة عن طريق أرسال الى,0
هدايا مجانية فورية من,1
عمريوجه سليمان الراجحي نصيحة للمستثمرين,0
عرض سوا الخاص الآن استمتع ب جيجا بايت بيانات و دقيقه مكالمات داخل الشبكه صالحة لمدة يوم ب ريال فقط لتفعيل العرض اتصل ب او ارسل الى للمزيد من عروض سوا اتصل ب,0
ملفات خطيرة اخترقت هاتفك قم بإزالة هذه الملفات للحفاظ على أمان بياناتك,1
اليوم عطور ون كولكشين المنعشة الجديدة مع الشاور بريال شامل الضريبة,0
تم تعليق بطاقة الخاصة بك مؤقتا لمنع إغلاق الحساب يرجى زيارة قم بالرد بالإيقاف لإلغاء الاشتراك,1
رسالة نصية الأحد أكتوبر مساء أوبرا تقدم أكبر هدية لها قسيمة رقم,1
لم نتمكن من شحن الطرد الخاص بك بسبب مشكلة العنوان حاجتك إلى تأكيد عنوانك لضمان التسليم,1
عرض كوستكو الترويجي على خط الفائز السعودي اللون أرجواني التخزين جيجابايت,1
انتهى فصل الصيف ولا تزال تبدو ضخما في المرآة جرب هذا لمدة أسبوع وتخلص من أكثر مما تتخيل,1
استطلاع لمدة دقيقتين مكافأة,1
قسيمة نعلن عن أحدث حلوى غذائية ذات نكهة طبيعية من أوبرا قسيمة,1
الموضوع رسالة مجانية لقد تم دفع فاتورتك لشهر مارس شكرا إليك هدية صغيرة لك,1
عزيز العميل تم حظر بطاقة الصراف اللآلي الخاصة بك لأنك لا تملك التحديث بعد اتصل بهذا الرقم على الفور للتحديث,1
بطاقة هدايا بقيمة ريالا سعوديا استبيان,1
كلمة مرور صالحة لمرة واحدةرمز ل الدخول تطبيق المباشر في,0
غسل اليدين بالماء والصابون هو أهم وسيلة للوقاية من فيروس كورونا اضغط الرابط لتتعرف على أهم طرق الوقاية الأخرى تحياتوزارة الصحة,0
تنبيه لقد تم حظر بطاقة الخصم المدفوعة مسبقا من بسبب نشاط غير عادي لإعادة تنشيط بطاقة الخصم المدفوعة مسبقا من يرجى زيارتنا على,1
عزيزي المواطن ة باب ماجاء في التسترالتجاري يحتوي على تعاريف أمثلة وقصص حقيقية تصفحه من خلال الرابط التالي البرنامج الوطني لمكافحة التستر التجاري,0
لقد تم تقييد حسابك تفضل بزيارة,1
عميلنا العزيزاشتراكك في باقة سوا شير سيتجدد بشكل تلقائي بتاريخ فضلا تأكد من توفر رصيد كافي قبل هذا التاريخ حتى نتمكن من تجديد اشتراكك,0
من واجهنا مشكلات في معالجة الدفعة الأخيرة لعضويتك في والحساب مقيد مؤقتا لمواصلة استخدام يرجى تحديث معلومات الفواتير الخاصة بك على وتجنب التعليق مع تحياتي قد يتم تطبيق أسعار على نوفمبر صباحا,1
تنبيهات المناطق هل حاولت تحصيل مبلغ ريالا سعوديا من بطاقتك في يوم الساعة مساء بتوقيت شرق الولايات المتحدة إلغاء الطلب هنا,1
حساب الخاص بك معلق مؤقتا يجب عليك تأكيد نشاطك الأخير لمواصلة استخدام حسابك,1
دعوة للمؤهلينالمؤهلات في التدريب تسجيل في دليل المدربين والمدربات بقسم التدريب,0
لدينا مشكلة مع معلومات الفواتير الخاصة بك يرجى تحديث,1
عزيزي السيد السيدة وصلت بضائعك إلى المستودع ولا يمكن تسليمها بسبب عدم اكتمال معلومات العنوان يرجى تأكيد أو تحديث عنوانك في الرابط أو انسخ الرابط إلى المتصفح وافتح رسالة,1
صدقه جاريه عن رحمه الله لا تترك قريب ولا صديق ولا احد تعرفه إلا وارسلت له هذا المصحف حتى يكتب لك مثل اجورهم المصحف كاملا مع تفسيره ويتم قلب الصفحات بلمس الشاشه اختيارالصوت تلاوه ترجمه تفسير ليس هناك أغلى منه كهدية و صدقه جارية لتعم الفائدة ان شاء الله,0
اشترك الحين في خدمة صحيفة الرياض وخلك أول من يعرف بآخر الأخبار الرياضية وذلك مقابل هللة يوميا للاشتراك اضغط على الرابط التالي أو أرسل إلى,0
كلمة مرور صالحة لمرة واحدةرمز ل اضافة المستفيد تطبيق المباشر,0
خدماتك تحولت إلى الحساب الجديد بنجاح,0
