text,label
يحتاج حساب واجهة المستخدم عبر الإنترنت الخاص بك إلى اهتمام عاجل بسبب بعض الأنشطة غير المنتظمة سيتم تقييد حسابك إذا لم يتم التحقق منه يجب عليك النقر والتسجيل باستخدام الرابط الآمن المتوفر أدناه ملاحظة أكمل عملية التحقق لإبقاء بطاقة الخصم الخاصة بك نشطة,1
مفاجآت تطبيق السحب على المازيراتي قربتاريخ السحب الأول بمجرد دخولك تطبيق تحصل على فرصة للفوز بواحدة من سيارات مازيراتي ليفانتي بإمكانك تسجل الدخول عن طريق الدخول المباشر الدخول برقم سري مؤقت لرقم محدد الدخول باسم المستخدم وكلمة المرور لمضاعفة فرصك بالفوز سجل الدخول بأرقامك الأخرى المسجلة باسمك وهذا فيديو قصير يشرح كيفية الدخول لتحميل تطبيق المفاجآت ما انتهت للمزيد أرسل إلى,0
عروضك الخاصة بإنتظارك مكالمات وبيانات وباقات وغيرها الكثير للحصول على هذه العروض يرجى إرسال إلى لا تفوت الفرصة الآن,0
وصلت جوائز الصيف للتو لفترة محدودة فقط احصل على فرصتك هنا,1
مرحبا لا تزال تدين لشركة بمبلغ ريالا سعوديا كرسوم جمركية لحزمتك السابقة قم بالرد لتحصل على رابط آمن لدفع فاتورتك,1
وفقا لتقارير الهيئة العامة للارصاد وحماية البيئة بتعرض بعض مناطق المملكة لتقلبات جوية وسحب رعدية ممطرة مصحوبة بزخات البرد ورياح هابطة مثيرة للاتربة والغبار من الفترة وحتى ه فإن الدفاع المدني يؤكد على أهمية أخذ الحيطة والحذر خاصة في الاماكن المفتوحة وعلى الطرقات واتباع تعليماته في مثل هذة الحالات متمنين السلامة للجميع,0
عزيزي العميل الرجاء تسديد مبلغ تقرير موجز رقم فاتورة السداد يرجى السداد خلال أيام تفاديا لإلغاء الطلب يرجى اختيار المفوتر شركة العلم لأمن المعلومات في نظام سداد,0
رصيد متجر بقيمة ريال سعودي لإنهاء استطلاع السريع بالقرب,1
صارت جيجا وتصفح لامحدود لمواقع التواصل الاجتماعي مع سوا بوست استمتع ببيانات لامحدودة لمواقع التواصل الاجتماعي جيجا انترنت بالإضافة إلى مكالمات لامحدودة داخل الشبكة صالحة لمدة أسابيع كل هذا ب ريال فقط للاشتراك أرسل إلى للمزيد عن باقات سوا أرسل إلى,0
يدعم البرنامج الوطني للكشف عن الموهوبين عنصر تنمية رأس المال البشري في رؤية وذلك بتمكينهم للدخول في برامج علمية وهندسية وتقنية وصحية يمكنكم التسجيل قبل ديسمبر على ولمزيد من المعلومات نتشرف بمتابعة حسابنا في تويتر,0
عميلنا العزيزعرض خاص ارسل إلى لتحصل على اشتراك تطبيق جوي تي في الآن بسعر ريال مع بيانات لامحدودة على التطبيق شاهد الجزء الثاني من ولاد رزق الآن على تطبيق جوي تي فيسعر الاشتراك بعد أشهر ريال شهري,0
نشاط غير عادي لقد قمنا بتعليق حسابك في أمازون بسبب نشاط غير عادي تم حظر محاولة تسجيل الدخول من تايوان قام نظامنا بتعليق حسابك في لأسباب أمنية لفتح حساب الخاص بك يرجى التحقق من خلال الرابط أدناه يتعين عليك اتخاذ الإجراء خلال يومين قبل تعليق الحساب مع تحياتي فرق الأمازون,1
أسعار التجوال في الأردنمكالمة محلية ريال للدقيقة مكالمة للسعودية ريال للدقيقة مكالمة دولية ريال للدقيقة استقبال المكالمات ريال للدقيقة إرسال الرسائل القصيرة ريال للرسالة الإنترنت ورسائل الوسائط ريال للميجابايت هذه بعض الأرقام الهامة التي قد تحتاج إليها خلال إقامتك في الأردنسفارة المملكة الخطوط السعودية الملحقية الثقافية الطوارئ طوارئ السعوديين العناية بالعملاء او مجاناولمزيد من المعلومات تواصل معنا مجانا على تطبيق مع ضرورة تسجيل جواز السفر للمواطنين السعوديين عبر الرابط التالي شحن خطك عن طريق تطبيق أو من خلال حسابك في أحد البنوك السعودية أو عن طريق خدمة حول لي عبر الخطوات ادناهبرسالة نصية إلى أرسل مسافة الرقم اللي تطلب منهمسافة المبلغ,0
عزيزي العميل لا تفوتك عروض التمويل الشخصي عبر تطبيق المباشر تقدم بطلبك الان دون الحاجة لزيارة الفرع,0
عززي العمل نرجو تحرث باناتك البنكة عدم تحدثا سوقف جمع الخدمات الخاصة بحسابك لتحدث باناتك فورا الرجاء الاتصال على الرقم التالي,1
لقد تم استلام فاتورتك للشهر الماضي شكرا لك إليك هدية صغيرة لك,1
لا حاجة للتمرين كوب واحد فقط قبل الليل وسيتلاشى بطنك الممتلئ بسرعة قم بالرد بالإيقاف لإلغاء الاشتراك,1
جيجا و دقيقة مع سوا لايك استمتع ب جيجا انترنت بالإضافة إلى جيجا لمواقع التواصل الاجتماعي و دقيقة داخل الشبكة كل هذا ب ريال فقط للاشتراك أرسل إلى لمعرفة المزيد عن باقات سوا أرسل إلى,0
لقد حصلت على رسالة نصية من انقر هنا للوصول إلى البريد الوارد,1
ادفع ريالا للتأمين الكامل على السيارة عدد محدود من المقترحات أسرع واضغط رد النهاية لإلغاء الاشتراك,1
كلمة مرور صالحة لمرة واحدةرمز ل الشراء من السوق الالكتروني تطبيق المباشر في,0
أسعار التجوال الدولي في تركيا بالريال السعودي الاتصال المحلي الاتصال إلى السعودية الاتصال الدولي استقبال المكالمة الرسالة النصية البيانات لكل ميجابايت,0
تحديث درجة الائتمان هناك درجة الائتمان الحالية الخاصة بك للحصول على التفاصيل افتح الرابط قم بالرد ب لإلغاء الاشتراك,1
عميلنا العزيزهذه بعض الأرقام الهامة التي قد تحتاج إليها خلال إقامتك في تونسسفارة المملكة الخطوط السعودية الملحقية الثقافية طوارئ السعوديين العناية بالعملاء مجانا,0
تحتوي بطاقة البطالة الخاصة بك على أنشطة غير منتظمة تم اكتشاف تسجيل دخول جديد إذا لم تكن أنت اتبع الخطوات,1
شباب البومب أبواب الحب جنون الجزء سلاسل ذهب والعديد من المسلسلات الرمضانية الحصرية تجدها في مكان واحد شاهدها في أي وقت وبدون إعلانات عبر تطبيق جوي تي ي انضم الآن وابدأ فترتك التجريبية لمدة أيام مجانا مع إمكانية الإلغاء في أي وقت حمل التطبيق الآن سعر الاشتراك بعد انتهاء الفترة المجانية ريال,0
نحن الخدمة البريدية نأسف لإبلاغك بأنه لا يمكن تسليم الطرد الخاص بك لإعادة جدولة التسليم يرجى زيارة المعاينة غير متاحة,1
عززي كوستومر كنت قد حصلت على جائزة مئتي ألف من ابر بنده ماركت جدا تنئة كبرة جدا ذا و السحب محظوظ التروجة رمضان كرم سعدة حتى تتمكن من الاتصال بنا على ذا العدد من,1
عروضك الخاصة بإنتظارك مكالمات وبيانات وباقات وغيرها الكثير للحصول على هذه العروض اطلب لا تفوت الفرصة الآن,0
سيتم إعادته إلى المرسل لقد قمنا بعدة محاولات للوصول إليك,1
دفع عبر نقاط البيع مدى اثير بطاقة مدى رقم,0
بدأت تخفيضات اكسترا الكبرى عبر الموقع الإلكتروني,0
نظرا لإجراء معاملة غير عادية قمنا بإغلاق بطاقة الخصم الخاصة بك مؤقتا قم بتأكيد التفاصيل الخاصة بك على صباحا,1
تم سداد مبلغ ريالا سعوديا إلى رصيد إذا لم تسمح بذلك قم بزيارة لإلغاء الدفع,1
عرض سوا الخاص لمعرفة العروض الخاصة اتصل ب أو ارسل إلى و يمكنك أيضا الاطلاع على العروض الخاصة باستخدام الرابط ادناه,0
سفرك لا يقطع تواصلك مع أحبابكمع خدمة حول لي من سوا يمكنك طلب تحويل رصيد من أحبابك أثناء سفرك عبر الخطوات أدناهبرسالة نصية إلى أرسل مسافة الرقم اللي تطلب منهمسافة المبلغ,0
عرض اليوم الخاصأرسل إلى واحصل على مجانا أيام اشتراك من تطبيق جوي تي في مجانا بيانات لامحدودة على التطبيق لمدة أشهر مجانا ريال رصيد داخل الشبكة لمدة أيام قيمة الاشتراك في جوي تي في بعد الفترة المجانية ريال شهريا ويمكن إلغاء الاشتراك في أي وقت عن طريق تطبيق ستتم اضافة ريال بعد ساعة من الاشتراك,0
عزيزي العميل تواصلك مستمر مع أحبابك حتى وأنت مسافر اشترك في باقات إنترنت التجوال لشرائح البيانات كويك نت باقة جيجا لمدة أسبوع بقيمة ريال الرمز باقة جيجا لمدة شهر بقيمة ريال الرمز للاشتراك أرسل رمز الباقة إلى لمعرفة الدول المشمولة أرسل إلى أو عن طريق تطبيق استخدام التطبيق مجاني أثناء التجوال,0
باقات إنترنت التجوال في الأردن جيجا يوم واحد ريال الرمز جيجا ايام ريال الرمز جيجا يوم ريال الرمز للاشتراك أرسل رمز الباقة إلى هذه الباقات تعمل على الشبكات التالية يمكنك معرفة الدول التي تشملها الباقات عند السفر لأكثر من دولة عن طريق أرسال الى,0
لأنك أحببتيه رجعناه من جديد اشتري عطرك واحصلي على الثاني بنصف السعر,0
نشاط غير عادي لقد قمنا بتعليق حسابك في أمازون بسبب نشاط غير عادي تم حظر محاولة تسجيل الدخول من تركيا قام نظامنا بتعليق حسابك في لأسباب أمنية لإلغاء قفل حسابك في يرجى التحقق من خلال الرابط أدناه يتعين عليك اتخاذ الإجراء خلال يومين قبل تعليق الحساب مع تحياتي فرق الأمازون,1
فرصه موسسة مكة تطرح فرصة كفالة يتيم اكفل يتيم ب شهريا أو في السنه عن طريق مؤسسة مكة المكرمة الخيرية الرقم الموحد رجال نساء ملاحظة ان ارسلتهإ فقد تكفل أكثر من يتيم دون أن تدفع شيءفقط اجعل نيتك لله,0
الان بطريقة اسهل ومع استرداد نقدي وفوري على محفظتك اشحن رصيد سوا عن طريق حمل التطبيق الآن,0
الآن تخفيضات على كافة الأصناففي جميع فروعالعربية للعود,0
إفصاحك المبكر عن رحلات سفرك هو خط الوقاية الأول لك وللمجتمع من انتشار فايروس كوروناالوقايةمنكورونا مع تحيات وزارة الصحة,0
تقدم أكثر من مجرد أسعار رائعة لديك الكثير من الفرص اليوم للحصول على ما يصل إلى ريال,1
ملفك الشخصي على الإنترنت لديه ارتباط محتمل بوجود ثغرة أمنية في النظام قم بتسجيل الدخول والتحقق من التفاصيل الخاصة بك على لمنع سرقة الهوية,1
عرض بطاقة الهدايا من,1
قال صلى الله عليه وسلم المؤمن في ظل صدقته يوم القيامة ساهم في بناء وصيانة المساجد للتبرع ب ريال يوميا للوقف أرسل إلى للتبرع ب ريال شهريا أرسل الى للتبرع مرة واحدة ب ريال أرسل رسالة فارغة إلى المؤسسة الخيرية للعناية بمساجد الطرق,0
مرحبا عزيزتي إليكم الصور التي أردت مشاركتها معكم اسمحوا لي أن أعرف ما هو رأيك,1
عميلنا العزيزعرض خاص ارسل إلى لتحصل على اشتراك تطبيق جوي تي في الآن بسعر ريال مع بيانات لامحدودة على التطبيق سعر الاشتراك بعد أشهر ريال شهري,0
لقد قمت بتسجيل الدخول بنجاح من الولايات المتحدة السعودية إذا لم تكن أنت قم بزيارة,1
ضاعفنا النت في سوا لايك احصل على جيجا خاصة بشبكات التواصل الاجتماعي جيجا إنترنت جيجا في شبكة واي فاي ومكالمات دقيقة داخل الشبكة كل هذا ب ريال فقط ورصيد مسترد بقيمة ريال عند تجديد الباقة صلاحية الباقة أسابيع للاشتراك أرسل إلى لا تفوت الفرصة العرض لمدة محدودة لمعرفة المزيد عن باقات سوا أرسل إلى أو عن طريق زيارة تطبيق,0
معلومات طبية,0
تحذير أمنياتصل بدعمنا على مدار الساعة طوال أيام الأسبوع بطاقة مجمدة حاليا معرف الرسالة ل,1
لقد تم دفع مدفوعاتك للشهر الماضي شكرا لك هذه هدية مفاجئة لك,1
لاتفوت الخصم سامسونج جالكسي نوت صار ب ريال فقط,0
الشيخ الشعراوى قالحذارى أن تمل من الصبر فلو شاء لحقق لك مرادك فى طرفة عين هو لا تخفى عليه دموع رجائك ولا زفرات همك هو لا يعجزه إصلاح حالك يحب السائلين بالحاح اليس يقول إنى جزيتهم اليوم بما صبروا لم يقل بما صاموا أو بما صلو او بما تصدقوا وذلك لأن الصبر عبادة تؤديها وانت تنزف وجعا فقط اصبر ول الاجر من ارحم الراحمين الوترجنةالقلوب,0
تم تعليق رسوم بقيمة ريالا سعوديا الرد بنعم للمعالجة ليس أنت تفضل بزيارة موقع قبل أغسطس قم بالرد بإلغاء الاشتراك لإيقاف التنبيهات مؤقتا,1
عائد بسيط قدره ريالا عند تقديم معلومات سهلة,1
أيام الأخيرة لعرض اشتري واحصلي على مجانا لا تفوتي الفرصة,0
تريد من الاتصال بك بخصوص أحد الطرود المعلقة الخاصة بك,1
تهانينا لقد حصلت على منحة مجانية بقيمة ريال من اليونيسف هذا البرنامج مخصص للأشخاص المتأثرين بوباء كوفيد للمطالبة بأموالك انقر على هذا الرابط,1
وفقا لحالة الاستخدام الخاصة بك أنت مؤهل لاستخدام حزمة السياسات الكاملة لسيارتك مقابل ريالا شهريا فقط انقر للحصول على قم بالرد بالإيقاف لإلغاء الاشتراك,1
ما لا تعرفه عن القهوة,0
عميلنا العزيزاحصل على رصيد إضافي مجانااشحن رصيد سوا باستخدام البطاقة البنكية من خلال تطبيق واحصل على من قيمة الشحن كرصيد إضافي صالح لمدة أيامالرصيد الإضافي يستخدم للمكالمات داخل الشبكة فقطاضغط على الرابط التالي لتحميل الاستفادة من العرض لمرة واحدة فقطسيتم إضافة الرصيد خلال فترة وجيزةالعرض صالح حتى,0
عززالعمل تم حظر بطاقة الصراف الألي الخاصة بك لأنك لم كن لدك حتى الآن التحدث إذا كنت ترد عمل بطاقة الصراف الألي الخاصة بك بشكل صحح فاتصل بذا الرقم على الفور,1
مفاجآت تطبيق مستمرة و مازيراتي متبقية سجل دخولك بتطبيق واحصل على فرصة للفوز بسيارة مازيراتي ليفانتي بإمكانك تسجل الدخول عن طريق الدخول المباشر الدخول برقم سري مؤقت لرقم محدد الدخول باسم المستخدم وكلمة المرور لمضاعفة فرصك بالفوز سجل الدخول بأرقامك الأخرى المسجلة باسمك وهذا فيديو قصير يشرح كيفية الدخول لتحميل تطبيق ما انتهت للمزيد أرسل إلى,0
يؤسفنا إبلاغك بأنه قد تم تعليق عضويتك في بسبب حدوث مشكلات تتعلق بمعلومات الفوترة الخاصة بك نرجو منك تحديث معلومات الفواتير الخاصة بك في أقرب وقت ممكن لمواصلة استخدام حسابك دون أي انقطاع لاستخدام حسابك كالمعتاد يرجى اتباع التعليمات بالنقر على الرابط أدناه خدمات,1
من رسالة الدفعة الشهرية ل غير ناجحة وحسابك مغلق مؤقتا شاهد التفاصيل الكاملة في المرفق أدناه فشل الاشتراك تم تضمين محتوى وسائط إضافي يرجى التحقق من الرسالة بالتفصيل,1
محل دار ستر لبيع الملابس المحتشمة انشروها للناس قبل العيد فإن من أعظم مايؤرق العفيفات وأولياءهن اللباس الساتر الراقي ادعموهم سترهم الله كما يسعون في ستر نساء المسلمين,0
عميلنا العزيزنأمل التأكد من تجديد اشتراككم بباقة سوا شير قبل حتى لا تفصل الخدمةأي رصيد مسترد سيتم فقده في حال عدم تجديد الباقة قبل إنتهاء صلاحية الرصيد للاستعلام عن الرصيد المسترد ارسل الى,0
عزيزي المتسوق لقد تم اختيارك عشوائيا للإجابة على استبيان قصير جدا سيتم الدفع لك مقابل وقتك,1
وزارة التعليم بعد تمكينها من إعلان وظائفها تدعو الخريجين والخريجات لشغل من الوظائف التعليمية الشاغرة,0
يرجى ملاحظة أن هذه هي هدية العطلة الصغيرة المفاجئة للتعبير عن ولائنا المتبادل لسجل الدفع المتميز الخاص بك دعونا نحظى بعام رائع آخر,1
خصم بيسيل مكينة التنظيف العميق ب رس فقط,0
حرصا على سلامتكم يؤكد الدفاع المدني أهمية اتخاذ اعلى درجات الحيطة والحذر ومراعاة جوانب السلامة عند هطول الأمطار ويدعو إلى تجنب مجاري السيول وتجمعات المياه نهتم بسلامتكم,0
للاستثمار الأمثل للوقت سماع أربع كتب تفسير التفسير الميسر المختصر في التفسير تفسير السعدي تفسير ابن جزي يعمل وأنت تتصفح جهازك قد لا تجد وقتا للسماع لكنك لن تعدم وقتا للنشر,0
وفقا لتقارير الهيئة العامة للارصاد وحماية البيئة بتعرض معظم مناطق المملكة لتقلبات جوية تتمثل في رياح نشطة مثيرة للاتربة والغبار وغيوم رعدية تصحب بامطار من متوسطة الى غزيرة فإن الدفاع المدني يؤكد على أهمية اتخاذ اعلى درجات الحيطة والحذر واتباع تعليماته في مثل هذة الحالات متمنين السلامة للجميع,0
عملاء أكمل هذا الاستبيان واكسب ما يصل إلى ريال من رصيد تنتهي هذه الصفقة الخاصة غدا الساعة صباحا,1
قام فريقنا بإغلاق الخصم الخاص بك في يوليو يرجى زيارة لفتحه قم بالرد بالإيقاف لإلغاء الاشتراك,1
تم استلام ل شكرا هذه هي الهدية الصغيرة التي أرسلتها لك,1
شراء عبر الأنترنت بطاقة مدى رقم,0
نظرا لأنك عميل محترم لشركة فلدينا تبرع بقيمة ريال مخصص لك ليس من لجهودك ما عليك سوى الرد على هذا الاستبيان المكون من سؤالين وسيتم تعويضك الرابط النهاية,1
الأمن العام يدعو الجميع لإختيار الأوقات المناسبة للعمرة والزيارة,0
هذه هي النصيحة الثانية والأخيرة نحن أداتك على الفور الرجاء القضاء على غير المرغوب فيها قم بالمسح الضوئي اليوم,1
عاجل شركات الاتصالات العاملة بالمملكة تعاود من جديد حجب الاتصال عبر تطبيق الواتساب الراصد نيوز,0
لقد تم حظر حسابك البنكي عبر الإنترنت بسبب أنشطة غير عادية يرجى التحقق من حسابك من خلال النقر على الرابط لاستخدام حسابك,1
الحلقة السادسة لسلسلة قلبية متميزة قلب يتعبد بالرجاء رابطه الحلقة على الساوند رابط الحلقة على اليوتيوب,0
ربما تم فرض رسوم زائدة على سياستك التلقائية لعام بحلول عام تحقق من إمكانية استرداد النقود لعام,1
هو الخاص بك لا تشاركه مع أي شخص إذا لم تقم بتقديم هذا الطلب قم بتسجيل الدخول للتحقق أدناه وإلا فتجاهل هذه الرسالة فريق أمازون,1
لقد تم خصم مبلغ ريالا سعوديا من حسابك مقابل معرف الطلب إذا لم تسمح بهذا اتصل بنا على,1
خلقت الأرض جميلة بالنقاء فلنحم جمالها من التلوثشاركنا فعاليات اسبوع البيئةولمعرفة أماكن الفعاليات بالمملكة زر الرابط تحيات وزارة البيئة والمياه والزراعة,0
لقد أرسلت للتو دفعة إلى بمبلغ ريالا سعوديا إذا لم تقم بإجراء هذه المعاملة فيجب عليك الإلغاء قبل ساعات,1
تنبيه تم تعطيل الخدمات المصرفية عبر الإنترنت الخاصة بك بسبب التحديثات الجديدة عبر الإنترنت لتحديث معلوماتك يرجى التحقق من ذلك على,1
اشترك بباقات الدقائق المحلية لكل الشبكات بصلاحية أسابيع دقيقة محلية لكل الشبكات ب ريال أرسل إلى للاشتراك دقيقة محلية لكل الشبكات ب ريال أرسل إلى للاشتراكللمزيد عن باقاتنا أرسل سوا إلى,0
عندنا لك مفاجأة حول أموالك دوليا مع برسوم تحويل ريال فقط حمل التطبيق الآن,0
كلمة مرور صالحة لمرة واحدةرمز ل تنشيط المستفيد,0
محتاج كاش الحل عندنا تقدم بطلبك الآن على أسهل تمويل,0
