text,label
احصل على خصم من صيدليات الدواء على جميع مشترياتك النقدية ماعدا الأدوية ومستلزمات حليب الأطفالحصول على العرض أرسل إلى سيتم خصم نقاط قطاف للحصول على العرضويمكنك تحويل نقاط أرباحي إلى نقاط قطاف من خلال الرابط ساري من إلى نوفمبر ولمزيد من العروض أرسل عروض قطاف إلى,0
عميلنا العزيزشاهد الحي الشرقي و حرب كرموز و ولاد رزق وغيرها حصريا على تطبيق جوي الآن ولفترة محدودة تطبيق جوي بسعر ريال شهريا فقطاشترك الآن عن طريق رقم جوالك وسيتم استقطاع قيمة الاشتراك من رصيد سواسعر الاشتراك بعد أول أشهر ريال شهرياشترك وحمل التطبيق الآن ممتعة,0
ريالك يمكن يجيب لك سيارة ادعم ناديك ب ريال واحد يوميا وادخل السحب أسبوعيا على سيارة أرسل اسم ناديك إلى,1
واو ريال مقابل خدمة لمدة دقيقة,1
كلمة مرور صالحة لمرة واحدةرمز ل الدخول المباشر للأفراد,0
لديك طرد بعنوان خاطئ في مستودع النقل لدينا يرجى تحديث عنوانك وصول,1
تم تحديث سجل سائق المركبة الخاص بك,1
عززالعمل تم حظر بطاقة الصراف الآلي الخاصة بك لأنك لم كن لدك حتى الآن التحدث إذا كنت ترد عمل بطاقة الصراف الآلي الخاصة بك بشكل صحح فاتصل بذا الرقم على الفور,1
تنبيهات محاولة معاملة محتملة في يناير بقيمة ريالا سعوديا لا أعتقد أنها من صنعك يرجى الاتصال بنا على الآن,1
لقد تم تقييد حسابك لقد قمنا بقفل معرف حسابك لأن خدمتنا اكتشفت محاولتين غير مصرح بهما لفتح حسابك يتعين عليك التحقق من حسابك انقر فوق الرابط أدناه لفتح حسابك سيتم إلغاء قفل حسابك تلقائيا بعد الانتهاء من عملية التحقق مع أطيب التحيات خدمة باي بال يا,1
قم الخدمات الحكومة وسام في بناء الوطن حمل تطبق وطني الآن,1
تمت دعوة رقمك مع شخصا آخر لاسترداد جائزة قم بالإجابة على استبياننا السريع قبل ال ساعات القادمة لحجز استبيانك على,1
لا يفوتك اسبوع العروض على متجر تمتع بخصومات على أفضل الألعاب والتطبيقات ابتدأ من ابريل وحتى ابريل لتفعيل الخدمة اختر من خلال الرابط التالي وقيمة المشتريات من المتجر تحسب من رصيدك إذا كنت من عملاء سوا أو تضاف لفاتورتك إذا كنت عملاء المفوتر,0
حقق راتب إضافي على طرقة رنده,1
جيجا بيانات وسوشال ومكالمات لا محدودة مع سوا ستار رقي باقتك واستمتع ب جيجا انترنت بالإضافة إلى بيانات لامحدودة لمواقع التواصل الاجتماعي ومكالمات لامحدودة داخل الشبكة كل هذا ب ريال فقط للاشتراك أرسل إلى,0
اليوم الأخير اشتري واحصلي على مجانا لا تفوتي الفرصة,0
أصدقائي الأعزاء مع بدء تعافي السوق ندعوكم للانضمام إلى مجموعة المناقشة الداخلية لفريق الاستثمار المحترف ستقوم المجموعة بنشر التداول اليومي وتعلمك كيفية تحقيق أرباح ضخمة في سوق العملات المشفرة,1
الرجاء إدخال الرمز التالى لإستكمال عملية التحقق,0
أخبار مذهلة لقد تم قبول طلبك أكمل العملية,1
عزيزي انضم إلى مجموعة دراسة مناقشة حيث يمكنك تعلم كسب يوميا يرجى النقر فوق,1
لا يمكن لشركة النقل التسليم لأن عنوان الطرد الخاص بك غير مفصل يرجى تحديث تفاصيل العنوان,1
خدمات تنبيه من لقد تم قفل بطاقة الخصم المدفوعة مسبقا الخاصة بك وهي قيد المراجعة بسبب أنشطة غير عادية في الحساب انقر فوق رابط الموقع الآمن المتوفر أدناه لمراجعة معلومات بطاقتك الصحيحة لإعادة تنشيط بطاقتك وإعادة فتحها الآن,1
إشعار من أمازون لقد قمنا بإغلاق حسابك في أمازون بسبب مشكلة في الفوترة لفتح حسابك في يرجى النقر على الرابط أدناه يرجى اتخاذ إجراء بشأن حسابك في غضون ساعة لتجنب الإلغاء الدائم عرض الكل,1
لا يمكن تسليم الطرد الخاص بك بسبب معلومات رقم المنزل غير الصحيحة يرجى ملء العنوان الصحيح عبر الإنترنت لإعادة التسليم,1
عادت كعميل حصلت على خصم هائل على العروض يصل إلى ريالا سعوديا تفضل بزيارة اضغط مع الاستمرار للتثبيت,1
عزيزي العميل يمكنك الآن اكتساب نقاط قطاف واستبدالها لدى فيرجن ميجاستور لمعرفة المزيد عن شركائنا قم بزيارة تطبيق,0
كلمة مرور صالحة لمرة واحدةرمز ل الشراء من السوق الالكتروني تطبيق المباشر,0
عزيزي العميلنفيدكم بأن باقات انترنت التجوال غير متوفرة في تركيا حيث يمكنك تفعيل إيزي نت أثناء التجوال لدفع حسب الاستخدام للأنترنت علما بان تعرفة الميجا الواحد هي ريال لتفعيل إيزي نت أثناء التجوال أرسل إلى لإيقاف إيزي نت أثناء التجوال أرسل إلى كما نفيدكم بأن باقة استقبال المكالمات أثناء التجوال خلال الإجازات غير متوفرة في تركيا حيث أن تعرفة استقبال المكالمات هي ريال,0
رمز التحقق,0
يوفر هذا المكيف الصغير المدمج دفعة من الهواء البارد المتجمد اطلبه الآن مع الخصم قم بالرد على النهاية لإلغاء الاشتراك,1
تم دفع دفعتك لشهر سبتمبر شكرا إليك هديتنا المفاجئة لك,1
هلا شايف اللي قاعد يصير التقنية التغطية المعاملات المالية اللعب الخدمة صار لها بعد جديد جاهز فيديو إطلاق السمة الجديدة معنا بهذه المناسبة مع عروضنا الشيقةيلا نروح أبعد,0
اطلب مسبقا سامسونج جالكسي واحصل على هدايا قيمة,0
هدايا مجانية سريعة من هوم ديبوت,1
سيتم منحك مكافأة واحدة بشكل عشوائي كواحد من بين شخصا عن طريق ملء استبيان قصير تنتهي المكافأة خلال ساعات,1
عزيزي العميل لديك بعض المشاكل مع بطاقة الصراف الآلي تم حظر بطاقة الصراف الآلي لذا قم بالتحديث مرة أخرى واتصل بهذا الرقم,1
بمناسبة ذكرى البيعة نجدد العهد والولاء لخادم الحرمين الشريفين الملك سلمان حفظه اللهو نهدي بهذه المناسبة جميع عملاء المفوتر وسوا بيانات إنترنت لامحدوده لتطبيقات التواصل الاجتماعي لمدة ساعة العرض يتفعل تلقائيايبدأ العرض في نوفمبر من الساعة صباحا وحتى مساءذكرىبيعةالملكسلمان,0
الموضوع الإخطار بسبب وجود مشكلة في معلومات بطاقتك قمنا بتعطيل حسابك على أمازون لأسباب أمنية لفتح حسابك يرجى اتباع الرابط أدناه هذا فقط,1
عميلنا العزيز الآن استمتع بباقات كويك نت مسبقة الدفع من رقم سوا بطاقات شحن كويك نت جيجا و جيجا و جيجا و جيجا ولا محدود أصبحت متاحة لعملاء سوا للحصول عليها تفضل بزياره فروعنا ارسل فرع الى للتعرف على أقرب فرع لك أو الموزعين المعتمدين مثل اكسترا و جرير أو متاجر الاتصالات لمعرفة معلومات أكثر عن باقات كويك نت تفضل بزيارة الرابط,0
عزز العمل تم إغلاق بطاق الصرف الخاص بك محظور إذا كنت ترغب في تحدث حسابك اتصل بذه الأرقام,1
بناء على ما ورد من هيئة الارصاد بشأن التقلبات الجوية على بعض مناطق المملكة بدء من يوم الاحد وحتى الخميس وما قد يصاحبها من هطول امطار غزيرة فإن الدفاع المدني يهيب بالجميع بأخذ الحيطة والحذر والابتعاد عن تجمعات المياه ومجاري السيول وبطون الأودية واتباع تعليمات السلامة الموجوده على الموقع,0
عميلنا العزيز هويتك شارفت على الانتهاء بادر بتجديدها تفاديا لايقاف حسابك وفي حال تم التجديد يمكنك تحديث بياناتك لدى المصرف من خلال موقع المباشر أو الاتصال بالرقم واختيار الرقم ثم دون الحاجة لزيارة الفرع,0
لقد ظهرت في قائمة الآلاف الذين اشتروااستخدموا بودرة الأطفال في مايو لذلك يجب أن تدفع لك جونسون آند جونسون ألفا قم بجمع معلوماتك هنا توقف حتى النهاية,1
لقد كانت الفاتورة الخاصة بك للشهر الماضي عبارة عن شكرا هذه هي هديتنا الصغيرة,1
عرض سوا الان استمتع ب جيجا بايت بيانات و دقيقة مكالمات داخل الشبكةصالحة لمدة يوم ب ريال فقط لتفعيل العرض اتصل ب او ارسل الى للمزيد من عروض سوا اتصل ب,0
الطلب من الحالة مكتمل التحقق من النتائج,1
تم اختيارك لعرض العمل من المنزل واحصل على راتبك اليومي تيرا بايت اتصل على,1
عميلنا العزيزنحيطك علما أنه تم تخصيص خدمة خاصة مجانية للإبلاغ عن الرسائل النصية القصيرة التي ترد وتتضمن رسائل احتيال مثل الرسائل المشبوهة والتي تطلب تحديث البيانات البنكية أو تفيد بوعود بالفوز بمكافئات وجوائز ماليةنأمل الإبلاغ عنها بإعادة إرسال الرسالة النصية القصيرة للرمزالموحد,0
انتظرونا منتصف الليل على الموقع ولمدة ساعة فقط عرض مميز ليوم مميز,0
عملينا العزيز دبل بياناتك مع كويك نت الحين تقدر تفعل باقات جيجابايت وبتجيك جيجابايت إضافية مجانا العرض مستمر إلى ديسمبر وإذا تبي تعرف أكثر أرسل إلى قنوات الرقمية في خدمتك تعرف على تفاصيلها بإرسال ذاتي إلى مجانا,0
الهدية الترويجية من هوم ديبوت احصل على ريالا مساء,1
فإذا قبضت الروح وأدخل القبر أتى إليه الثبات يثبت الله الذين آمنوا بالقول الثابت يثبت يوم يأتيه أيضا عمله الصالح على هيئة رجل فيقول له أنا عملك الصالح يستبشر به و بوجه فإذا كان على هذا الحال ووضع في قبره أتاه هذا العمل يدافع عنه فلو أراد العذاب ان يأتيه من قبل رأسه قالت الصلاة ما قبلي مدخل فأي صلاة صلاتنا وقال الصيام عن يمينه ما قبلي مدخل الله يرحم ضعفنا وقلة حيلتنا وكانت الزكاة والصدقات عند شماله قالت ما قبلي مدخل وكان فعل الخيرات من المعروف والإحسان عند رجليه قالت ما قبلي مدخل ثم يجيب أسئلته الثلاث التي يعلم ان الله تعالى قد أعد لهذا السؤال تثبيت وجوابا أن هو صدق مع الله سبحانه وتعالى,0
لم يكتمل التسليم الخاص بك بسبب مشكلات التحقق من صحة العنوان الوصول إلى للمساعدة في إعادة التسليم,1
العرض الخاص لليومأرسل إلى واحصل على تطبيق جوي الذي يحتوي على الآف الأفلام والمسلسلات وقنوات التلفزيون لامحدوده ب ريال لمدة شهر مجانا جيجا بايت لمدة أيام ابتداء من مارسيمكنك إلغاء الاشتراك في أي وقت من خلال تطبيق,0
من نظرا لأنك عميل محترم لشركة فلدينا هدية بقيمة ريال مخصصة لك وليس من لوقتك ما عليك سوى الاعتراف بهذا الاستبيان المكون من ثلاثة أسئلة وسوف تتمكن من ذلك يتم تعويضه النهاية,1
كلمة مرور صالحة لمرة واحدةرمز ل الدخول المباشر للأفراد في,0
لقد كان الخاص بك محدودا لقد قمنا بتجميد حساب الخاص بك لأن خدمتنا اكتشفت محاولتين غير مصرح بهما لفتح حسابك يتعين عليك التحقق من حسابك انقر فوق الرابط أدناه لفتح حسابك سيتم إلغاء قفل حسابك تلقائيا بعد الانتهاء من عملية التحقق مع أطيب التحيات دعم باي بال,1
اربح ما يصل إلى ريال من قيمة متجر يرجى إنهاء الاستبيان للحصول على المكافآت,1
عرض هوم ديبوت ريال سعودي,1
لقد قمت بإدخال عنوان تسليم غير صحيح يرجى تحديث عنوانك إلى مكتب البريد,1
عميلنا العزيز نفيدكم بأنه تم استنفاذ كامل رصيد الدقائق من باقة سوا خارج الشبكة للاشتراك في إحدى باقات سوا ارسل إلى او عبر تطبيق أو موقع خدماتي,0
شحن سوا صار أسهل اشحن سوا من خلال حسابك البنكي باستخدام القنوات المتاحة كموقع الإنترنت وأجهزة الصراف الآلي وتطبيقات الأجهزة الذكية والهاتف المصرفي والبطاقة الائتمانية وكذلك يمكن شحن سوا من الخط المفوتر لمعلومات أكثر تفضل بزيارة الرابط,0
أفضل مكان للحصول على أموال صغيرة أموال بالتقسيط تصل إلى ريال اذهب إلى هذا الرابط,1
يسر عمادة الدراسات الجامعية للطالبات دعوتكن لحضور اللقاء السنوي لطالبات مقر الزاهر بعنوان نحن صناع السعادة الأربعاء الساعة ص الى م في قاعة الجوهرة,0
يا عزيزي هل تعلم أقوم بتحديث معرض الصور الخاص بي من ملفي الشخصي ابحث عنها هنا,1
عزيزي العميل باقة سوا يوم تمنحك افضل المزايا فقط ب ريال لمدة ساعة دقيقة داخل الشبكة رسالة داخل الشبكة ميجابايت انترنت للإشتراك أرسل الرمز إلى وللإطلاع على جميع الباقات أرسل إلى,0
اضافة الى حسابك في اليكترون,0
عميلنا العزيز نفيدكم بأنه تم استنفاذ من رصيد الدقائق من باقة سوا خارج الشبكة للاشتراك في إحدى باقات سوا ارسل إلى او عبر تطبيق أو موقع خدماتي,0
تقوم بإعادة مبلغ ريالا إليك الوقت المتبقي للمطالبة ساعة,1
عمراحصل على النصيحة من سليمان الراجحي,0
لقد تم تقييد حالة حساب المدفوع مقدما يرجى تحديث معلوماتك للاحتفاظ بحسابك عن طريق زيارة,1
كلمة مرور صالحة لمرة واحدةرمز ل تنشيط الفواتير تطبيق المباشر في,0
تنبيه تم تعطيل بطاقة المدفوعة مسبقا لأسباب أمنية تفضل بزيارة وأعد تنشيط بطاقتك الآن,1
مشترياتك من نون على احصل على قسيمة شرائية بقيمة ريال لمشترياتك من نون عند اشتراكك بباقةسوا شير سعر الباقة ريال ينتهي العرض بتاريخ فبراير للإشتراك في باقةسوا شير أرسلالى لمعرفة معلومات عن باقات سوا أرسل سوا إلى الحد الأدنى لقيمة الطلب هو ريال لمزيد من المعلومات عن العرض أرسل نون ل ستصلك رسالة نصية برمز القسيمة الشرائية بعد ساعة من الإشتراك في الباقة,0
تخيل تحاسب على قهوتك بمسحة جوال أو تسحب كاش بدون بطاقة صراف حمل وتفاجأ كيف حياتك تصير أسهل ما في زي اضغط على الرابط للتحميل,0
تنبيه لقد طلبت مؤخرا التحويل إلى حساب خارجي جديد إذا لم يكن هذا أنت قم بالإلغاء فورا على,1
خصم من حسابك في مدفوعات سداد,0
أسبوع تقدير أكمل الاستبيان السريع واكسب ما يصل إلى ريال من رصيد,1
تم إلغاء تنشيط بطاقتك المدفوعة مسبقا بدءا من انقر أدناه لإعادة التنشيط الآن,1
معرف الطلب مرحبا كان رجل التوصيل على بابك لقد افتقدناك أخبرنا متى يمكننا العودة اليوم,1
توفيرك صار أكثر مع سوا لايك احصل على دقيقة داخل الشبكة و جيجا لبرامج التواصل الاجتماعي و جيجا انترنت وجيجا انترنت على شبكة الواي فاي الرصيد المطلوب ريال بس أرسل الى للاشتراك بباقة سوا لايك صلاحية الباقة اسابيع احصل على مكالمات لا محدودة داخل الشبكة و جيجا لبرامج التواصل الاجتماعي و جيجا انترنت و جيجا انترنت على شبكة الواي فاي سعر الباقة ريال بس أرسل الى للاشتراك بباقة سوا شير صلاحية الباقة اسابيع للمزيد عن باقات سوا أرسل إلى,0
عزيزي العميل تم حظر جهاز الصراف الآلي الخاص بك إذا كنت تريد تحديث الاتصال بهذا الرقم,1
تنبيه بنك تم قفل حسابك عبر الإنترنت مؤقتا بسبب نشاط مشبوه الرجاء تسجيل الدخول والتحقق من المعلومات الخاصة بك,1
يمكننا أن نمنحك ما يصل إلى ريالا سعوديا للديزل شكرا لك على دقيقتين ستنفقهما على الاستطلاع اضغط على الرابط قم بالرد ب لإلغاء الاشتراك,1
خصم من حسابك في فواتير,0
عميلنا العزيز الاتصالات السعودية ترحب بعودتك وحمدا لله على سلامتك,0
الحقوا بدء التقديم اليوم وظيفة إدارية وفنية للرجال والنساء في وزارة البيئة رابط التقديم هنا انشروها اكسبوا الأجر لإخوانكم,0
عزيزي العميل في حال كان لديكم تحديث لمعلومات الأسرة بالإضافة أو الحذف لغرض الاكتتابات القادمة نرجو زيارة أقرب فرع,0
يبدو أنه تم فرض رسوم زائدة عليك على سياسة الخاصة بك لم يفت الأوان بعد لتطبيق والحصول على تعويض,1
لقد فشلنا مرات في تمديد اشتراكك أصلح فاتورتك الآن,1
تنبيهات الاحتيال في لاحظنا وجود أنشطة غير عادية في حسابك يرجى تأكيد الأنشطة الموجودة على لجعلها آمنة,1
نظرا لإستمرار التوقعات بهطول الأمطار ولسلامتكم فإن الدفاع المدني يهيب بالجميع بأخذ الحيطة والحذر والإبتعاد عن مجاري السيول وبطون الأودية وتجمعات المياه متمنين السلامة للجميع,0
استطلاع لمدة دقائق للحصول على هدية بقيمة ريال من,1
جرب هذا الكيتو لمدة أيام ولن يتعرف عليك أصدقاؤك لقد تم استبدال التدريبات قم بالرد على النهاية لإلغاء الاشتراك,1
كاشفالدخانلكامان بمبلغ بسيط تحمي نفسك وعائلتك من حدوث كارثة لا قدر اللهمع تحيات المديرية العامة للدفاع المدني,0
نظرا لأنشطة غير عادية فقد قمنا بإغلاق بطاقة الخصم الخاصة بك مؤقتا قم بتأكيد التفاصيل الخاصة بك على انقر مع الاستمرار للتثبيت,1
التماس الأصدقاء الوارد من الرد الآن,1
هذه هدية للتعبير عن امتناننا لسجل الدفع الاستثنائي الخاص بك عام سعيد تي موبايل,1
عزيزي العميل اشترك في باقات التجوال للإنترنت في تونس على شبكة باقة ميجا لمدة يوم بقيمة ريال الرمز باقة جيجا لمدة أسبوع بقيمة ريال الرمز باقة جيجا لمدة شهر بقيمة ريال الرمز للاشتراك يرجى ارسال رمز الباقة الى و لمعرفة الدول والشبكات التي تشملها الباقة ارسل إلى ولباقات التجوال للمكالمات ارسل الى علما بأن بإمكانكم استخدام تطبيق مجانا اثناء التجوال,0
عزز العمل تم إغلاق بطاقة الصراف الال الخاصة ب اذا نت ترغب تحدث اتصأل بذه الرقم,1
عبدالرحمن رسالة من سليمان الراجحي للمقبلين على التجارة,0
الهبة النهائية من,1
بنك الغرب للمراجعة الأمنية بسبب نشاط غير عادي تحقق من الحساب على,1
لقد وجدنا معاملة مشبوهة ولأسباب أمنية قمنا بإلغاء تنشيط حسابك يرجى تأمين طريقة الدفع الخاصة بك والتحقق منها لإعادة تنشيط حسابك وانقر واتبع التعليمات من الرابط التالي,1
أنت واحد من الاختيارات النهائية القليلة في برنامج جوائزنا الأخير ويمكنك استرداد من مكافأة مقابل استطلاع مدته دقيقة واحدة,1
رسالة مجانية فاتورتك مدفوعة لشهر مارس شكرا إليك هدية صغيرة لك توافق,1
عميلنا العزيز تمتع بعالم من الخدمات والمزايا العديده عند تسجيلكم في موقع خدماتي او بتحميل تطبيق للأجهزة الذكية,0
لقد قمنا بتعليق خدمة الخاصة بك مؤقتا لاستعادة اتبع التعليمات أدناه يرجى إكمال عملية الاسترداد خلال يومين وإلا فسيتم تعليق حساب أمازون نهائيا نحن نأسف على أي إزعاج قد يكون سببه هذا الأمر شكرا لكم على اهتمامكم يا,1
حوالة واردةمحليةعبر الى مبلغ في,0
منصة التعدين السحابي انسخ متصفح الموقع وافتح التسجيل لتحصل على ريال مجانا سيتم إضافتها إلى الحساب خلال ثوان يمكن أن تكسب المشاركة في التعدين السحابي حوالي ريال في اليوم الدخل الدائم مضمون وخالي من المخاطر قم بدعوة أصدقائك للانضمام والحصول على مكافآت رائعة,1
شراء عبر نقاط البيعبطاقةمدىأثير من لدى مبلغ في,0
