text,label
المكالمات الواردة لك اضبطها صح الآن تحكم بمكالماتك على كيفك مع خدمة جوال كنترول اللي تتيح لك التحكم في حجب أو رفض المكالمات والمزيد من المزايا الأخرى للاشتراك أرسل إلى للإلغاء أرسل إلى يمكنك الاشتراك والالغاء عن طريق قيمة الاشتراك ريالشهر,0
لدى أكثر من مجرد صفقات رائعة اليوم لدينا فرص كبيرة لك للحصول على ما يصل إلى ريال,1
استمتع بأفضل المسلسلات والأفلام والقنوات الإضافية مع فيديو الذي يتوفر دائما على نحو جديد تشاهده,1
تنبيهات بالنسبة إلى وضع الحجز الأمني الخاص بك على بطاقة التأمين ضد البطالة الخاصة بك بسبب سرقة الهوية قم بزيارة لإزالة الحجز,1
أرسل إلى و استمتع بتجربة مجانية لتطبيق جوي تي في لمدة أيام آلاف الأفلام و المسلسلات بانتظارك بالإضافة إلى قنوات البث المباشرسعر الاشتراك بعد الفترة المجانية ريال تتجدد شهرياتقدم الفترة المجانية للعملاء الجدد فقط,0
معا لأجل التمكين سجل رغبتك في الحضور للمشاركة في الخطة الاستراتيجية وسيتم السحب على أجهزة آيباد,0
احصل على مكافأة بقيمة ريال من,1
نشاط غير عادي لقد قمنا بإغلاق حسابك في أمازون بسبب نشاط غير عادي تسجيل دخول جديد من روسيا قام نظامنا بقفل حسابك في لأسباب أمنية لفتح حساب الخاص بك يرجى التحقق من هويتك أدناه لم تقم بالتحقق من هويتك إذا قبل ساعة سيتم التحقق من حسابك في أمازون تم إنهاؤه,1
لقد تم شحن جوالك ب ريال,0
كتاب كفايات الحاسب الآلي النسخة للعام لشرح جميع المعايير بالاضافة لنماذج اسئلة من الاعوام السابقة للتحميل من هنا,0
تبي تريح بالك من المكالمات وترد على اللي تبي بدون إحراجات مع موجود إكسترا تقدر تحول مكالماتك ويظهر للمتصل إن جوالك مقفل وراح يجيك تنبيه بمعلومات المتصلين للاشتراك أرسل إلى للإلغاء أرسل إلى يمكنك الاشتراك والالغاء عن طريق قيمة الاشتراك ريال شهريا,0
عضويتك معلقة لاستخدام حسابك كالمعتاد تحتاج إلى تحديث بعض المشاكل المتعلقة بمعلومات الفواتير الحالية انقر فوق الرابط أدناه لتحديث حسابك مع تحياتي المحدودة,1
خصمعند شرائك واكثر من منتجات الشعر الجديدة كليا وبخصائصها الجديدة,0
المدفوعات النقدية عن طريق,1
احصل على ريال سهل كل ما عليك فعله هو تقديم بعض المعلومات وسوف تصبح ثريا قريبا,1
جيجا ومكالمات لا محدودة مع سوا شيراستمتع ب جيجا انترنت بالإضافة إلى جيجا لمواقع التواصل الاجتماعي ومكالمات لامحدودة داخل الشبكة كل هذا ب ريال فقط للاشتراك أرسل إلى لمعرفة المزيد عن باقات سوا أرسل إلى,0
الخدمة البريدية بسبب العنوان غير صحيح لا يمكن تسليم الطرد يرجى اتباع الرابط لتحديث العنوان الصحيح,1
لايفوتك العرض بآخر يومين سامسونج جالكسي ب رس,0
مرحبا أنا سامي وقد قمت للتو بتحميل أفضل مقاطع الفيديو الجديدة على موقعي الشخصي تجده هنا,1
هل ينتقل فيروس كورونا عبر الشحنات القادمة من الصينبناء على المعلومات المتوفرة حالي لايوجد خطر في البضائع المستوردة من الصينأسئلة أكثر ومعلومات مهمة حول كورونا تجدونها على هذا الرابط تحياتوزارة الصحة,0
رسائل المجانية تم حظر الخصم الخاص بك بسبب نشاط غير منتظم للتصديق يرجى اتباع,1
بمناسبةذكرىالبيعة نجدد العهد والولاء ونهديكم سوشل بلا حدود لجميع عملاء المفوتر وسوا لمدة ساعة يوم الإثنين ربيع الآخر الموافق ديسمبر من الساعة ص وحتى الساعة م تم تفعيل العرض بشكل تلقائي لكل عملاء المفوتر وسوا,0
تعوضك بمبلغ ريال الوقت المتبقي للمطالبة ساعة ستعوض لك مبلغ ريال الوقت المتبقي للمطالبة ساعة,1
المناطق لقد تم منع استخدام الخصم الخاص بك بسبب سلوك غير عادي انتقل إلى التفاصيل الخاصة بك لإعادة التنشيط,1
مرحبا أنا أخبار عظيمة لقد سددت ما لا يقل عن من هاتفك الحالي إذا كنت مهتما بمعرفة عرضنا على قم بالرد بنعم لتلقي التفاصيل,1
ترغب شركة البيع بالتجزئة التابعة ل في مساعدتك في هذا الاستبيان الرسمي وأي شخص يدخل في هذا الاستبيان سيحصل على استبيان مجاني عن المنتج,1
خصم من حسابك في نقد,0
خليناها جيجا في سوا لايك احصل على جيجا خاصة بشبكات التواصل الاجتماعي جيجا إنترنت مع جيجا إضافية جيجا في شبكة واي فاي ومكالمات دقيقة داخل الشبكة كل هذا ب ريال فقط صلاحية الباقة أسابيع للاشتراك أرسل إلى سيتم تفعيل ال جيجا الإضافية خلال ساعة العرض صالح لمدة أيام فقط لمعرفة المزيد عن باقات سوا أرسل إلى أو عن طريق زيارة تطبيق,0
عززالعمل تم حظر بطاقة الصراف الآلي الخاصة بك لأنك لا تملك التحدث بذا الرقم على الفور للتحدث,1
يحتوي سجل سيارتك على إدخال جديد,1
عكس عمليةبطاقةمدى الى لدى مبلغ في,0
شاهد الموسم السادس الان ارسل ل للاشتراك بتطبيق جوي تي في ومشاهدة الموسم السادس والأخير من مقابل ريال فقط شهريا كرسوم مخفضة لأول شهوربالاضافه الى ايام مجانا وبيانات لامحدوده على التطبيق,0
معارضنا الآن مفتوحة لخدمتكم في تخفيضات اكسترا الكبرى,0
عميلنا العزيز شكرا لتزويدنا بالبصمة لإتمام عملية التحقق بيانات عملية التحقق كالتالي رقم الخدمة رقم العملية الحكومي رقم العملية الداخلي تاريخ العملية حالة العملية ناجحة,0
أرسل لك هذه الصور تجد أدناه,1
ضع إضافتنا على سيارتك وادفع سبعمائة ريال أسبوعيا لمزيد من التفاصيل اضغط على,1
عميلنا العزيزعروضك الخاصة من سوا في انتظاركاستخدم الرابط التالي للدخول فضلا تأكد من ايقاف الواي فاي قبل الدخول على الرابط أعلاه,0
مجتمعين أي بيتزا كبيرة مع طلب جانبي ب ريال بس طوال الأسبوع لطلبات الأونلاين المستلمة من الفرع,0
الموضوع تسجيل دخول جهاز جديد تمت محاولة تسجيل الدخول إلى من متصفح غير معروف يرجى التأكد من صحة التفاصيل التالية قبل السماح بتسجيل الدخول الوقت فبراير عنوان المتصفح الموقع تكساس الولايات المتحدة السعودية إذا كانت التفاصيل المذكورة أعلاه صحيحة فيمكنك تجاهل هذه الرسالة القصيرة إذا لم يكن الأمر كذلك فانقر على الرابط التالي لتحديث حسابك إذا لم تقم بالتحديث قبل ساعة فسيتم إنهاء حسابك تلقائيا,1
لقد تم تعطيل بطاقتك أعد تمكينه على لإبقائه سليما,1
احصل على بطاقة هدايا بقيمة ريال من,1
صارت جيجا مع سوا شير استمتع ب جيجا لمواقع التواصل الاجتماعي جيجا انترنت بالإضافة إلى مكالمات لامحدودة داخل الشبكة صالحة لمدة أسابيع كل هذا ب ريال فقط للاشتراك أرسل إلى للمزيد عن باقات سوا أرسل إلى,0
توفيرك صار أكثر مع سوا لايك احصل على دقيقة داخل الشبكة و جيجا لبرامج التواصل الاجتماعي و جيجا انترنت وجيجا انترنت على شبكة الواي فاي الرصيد المطلوب ريال بس أرسل الى للاشتراك بباقة سوا لايك صلاحية الباقة اسابيع احصل على مكالمات لا محدودة داخل الشبكة و جيجا لبرامج التواصل الاجتماعي و جيجا انترنت و جيجا انترنت على شبكة الواي فاي سعر الباقة ريال بس أرسل الى للاشتراك بباقة سوا شير صلاحية الباقة اسابيع للمزيد عن باقات سوا أرسل إلى السعر لا يشمل ال ضريبة القيمة المضافة لتحصيلها مسبقا عند شراء بطاقة الشحن,0
الخطوط السعودية تعلق الرحلات من وإلى باكستان,0
شاهد بطولة العالم للوزن الثقيل في الملاكمة مباشر على جوي تي ي بين الملاكمين آندي رويز جونيور وأنتوني جوشواسوف يتم نقل المباراة الساعة صباحا على تطبيق جوي تي ي على قناة ارسل الى واشترك في تطبيق جوي تي ي بسعر ريالشهري وشاهد المباراة على قناة سعر الاشتراك بعد أشهر ريال شهري,0
لا تفوتها احصل على دقيقة محلية من موبايلي لجميع الشبكات صالحة لمدة شهر كامل مقابل ريال فقط للإشتراك بالباقة أو لتجديد اشتراكك في حال انتهاء رصيد الدقائق المجانية لديك ارسل الى الإشتلراك يتجدد تلقائيا نهاية المدة اذا كنت ترغب في الغاء اشتراكك بالعرض فضلا ارسل إلى,0
تم قفل حسابك بسبب محاولة احتيال تمت في ديسمبر لمنع إغلاق الحساب يرجى زيارة للتحقق من,1
عميلنا العزيز نفيدك بانه تم استنفاذ من باقة البيانات لعرض الهوية الجديدة جيجا بيانات إضافية للاستعلام عن البيانات المتبقية ارسل الى,0
عميلنا العزيزارسل إلى لتحصل على اشتراك تطبيق جوي تي في الآن بسعر ريال مع بيانات لامحدودة على التطبيق لأول ثلاثة أشهر شاهد الفلم قصة حب الآن حصريا على تطبيق جوي تي فيسعر الاشتراك بعد أشهر ريال شهري,0
شراء انترنت بطاقةمدى من لدى مبلغ في,0
لديك كيف يمكنك الاستثمار والتسجيل كيف يمكنك المشاركة أرسل لي رسالة عبر,1
عزيزالعميل تم حظر بطاقة الصراف الآلي الخاصة بك لأنك لم يكن لديك حتى الآن التحديث إذا كنت تريد عمل بطاقة الصراف الآلي الخاصة بك بشكل صحيح فاتصل بهذا الرقم على الفور,1
لقد تم استلام فاتورتنا للشهر الماضي شكرا لك إليكم مكافأة الولاء الصغيرة لدينا,1
مولات اكا تقدم قسمة شرائة مجانا بمناسبة عد الأضحى المبارك ومرور سنة على تأسسا سارع وأحصل على قسمتك قبل نفاذ الكمة من نا,1
لا تفوت احتفال زعيم آسيا بنقل حي ومباشر على تطبيق جوي تي فيأرسل إلى وكن مع الحدث الأهمبقيمة ريال اشتراك شهريا لمدة ثلاث أشهر,0
عزيزي العميل تقريرك للمركبة ح و ص جاهزأضغط على الرابط التالي,0
الاتحاد الائتماني ألتورا إشعار الحساب عبر الإنترنت انقر أدناه لفتح الرسالة,1
تأكد من الحصول على ما لديهم من شركة لأنهم نادرا ما يتنازلون عن ريالا لذلك عليك أن تحصل عليه عندما تستطيع,1
سوف تحصل على الحزمة الخاصة بك اليوم يا رسالة نصية,1
يجب تصحيح عنوان التسليم الخاص بك هنا قم بتمكين إعادة تسليم العناصر المرتجعة,1
شراء عبر نقاط البيعبطاقةمدىأثيرمنلدى مبلغ في,0
محتاج كاشأطلب أسهل تمويل كاش متوافق مع أحكام الشريعة,0
خليناها جيجا في سوا لايك احصل على جيجا خاصة بشبكات التواصل الاجتماعي جيجا إنترنت مع جيجا إضافية جيجا في شبكة واي فاي ومكالمات دقيقة داخل الشبكة كل هذا ب ريال فقط صلاحية الباقة أسابيع للاشتراك أرسل إلى لا تفوت الفرصة العرض لمدة محدودة هذا العرض متاح حتى يوليو سيتم تفعيل ال جيجا الإضافية خلال ساعة لمعرفة المزيد عن باقات سوا أرسل إلى أو عن طريق زيارة تطبيق,0
همة حتى القمة اشتري ب واحصل على زيت عطري المحارب,0
مرحبا بك في الرسائل النصية القصيرة من قم بالرد ب مساعدة للمزيد أو إيقاف لإلغاء الاشتراك في تلقي الرسائل تنطبق الأسعار القياسية جوستينا بريتن نشكرك على الاشتراك لتلقي رسائلنا التسويقية أرسل رسالة نصية إلى لإلغاء الاشتراك جوستينا بريتن لقد تلقيت قسيمة لعملية الشراء القادمة استخدم الرمز لإلغاء الاشتراك في أي وقت أرسل رسالة نصية أو رسالة نصية لمزيد من المعلومات,1
عزيزي المواطن والمقيم تجاهل الرسائل النصية المشبوهة التي تطلب منك تحديث بياناتك البنكية فتلك رسائل احتيال يجب الحذر منها وعدم التجاوب معها,0
تنبيه أرسل لك رسالة خاصة اقرأ وقل مرحبا أدناه,1
نسالك يارب في هذه الجمعه أن تحفظ علينا النعم وتدفع عنا النقم وأن ترزقنا حلو الحياة وخير العطاء وسعة الرزق وراحة البال ولباس العافية وحسن الخاتمة واكتب اليسر لمن يعاني من العسر والراحه لمن به هم والسعاده لمن لازمه الحزن والشفاء لمن لامسه المرض والمغفرة لمن سبقنا للقبر والإجابة لمن يدعيك اللهم صل وسلم على نبينا محمد,0
السلام عليكم ورحمة الله وبركاته مثل ما في العنوان اسم القناة سعود وسارة من أفضل قنوات الأطفال هدفها تعليم القرآن وغرس الفضيلة في نفس الطفل وتقديمه في مسلسل بأسلوب مشوق ومحبب للطفل اشتركوا لاطفالكم وشاهدوا مسلسل سعود وساره اول مسلسل يعلم الاطفال القران الكريم وهذا هو الرابط اضغط واشترك انشر واحتسب الأجر,0
مبروك لقد فزت معانا بملون لاستلام الجائزة نرجو التواصل على,1
تحذير من اختراق أمان الهاتف المحمول تحذير انتهكت التطبيقات أمان هاتفك المحمول اتخاذ إجراءات سريعة لإزالتها للحصول على المساعدة انقر فوق,1
إذا سبق لك زيارة فأنت مؤهل للحصول على هذه الهدية الرائعة,1
تبقى يومين على السحب سارع بدعم ناديك جهاز جوال ذكي بإنتظارك كل أسبوع ادعم ناديك ب ريال يوميا وادخل السحب على جهاز جوال ذكي أرسل اسم ناديك إلى,1
ظهر اسمك في هذا الاستعلام بسبب فقدان فاتورة ريالا للطاقة,1
خدمة التوصيل وصل الخاص بك إلى مركز التوزيع وتنسيق عنوانك غير صحيح يرجى التحديث,1
كلمة مرور صالحة لمرة واحدةرمز ل اضافة المستفيد تطبيق المباشر في,0
لقد تم إيقاف عمليات التسليم الخاصة بك بسبب عدم وجود رمز الشارع على الملصق الرجاء التحديث,1
عميل احصل على ريال,1
كلمة مرور صالحة لمرة واحدةرمز ل التحويل تطبيق المباشر,0
مشكلة تم تقييد حسابك تحقق من ذلك هنا فورا,1
ارسل الى واحصل على تطبيق جوي ب ريال شهري مع بيانات لا محدودة على جوي اشترك الان وأول أيام مجانا للعملاء الجدد لأول أشهر بسعر ريالشهري بدلا من ريالشهريهذا العرض متاح لك فقط حتى تاريخ م,0
لم تتم معالجة دفع فاتورتك كما هو مقرر ونحن هنا لمساعدتك في حل المشكلة اتبع للمراجعة,1
احصل على جيجا بيانات مجانية لمدة ايام عند الاشتراك في تطبيق جوي تي في ارسل إلى للاشتراك في تطبيق جوي تي في بسعر ريال شهري والحصول على العرض الخاص ستصلك البيانات المجانية بعد ساعه من الاشتراك سعر الاشتراك بعد أشهر ريال شهري,0
مطاردة المحمول الوصول عبر الإنترنت مغلق بسبب عدة محاولات فاشلة للتحويل البنكي من يرجى تحديد التفاصيل الخاصة بك على لفتح القفل,1
سنمنح ريالا لأول شخص يكملون هذا الاستفسار من أجل تقديم خدمة أفضل لأعضاء يمكن أن يكون نظام مفيدا جدا إذا لم تكن على ما يرام,1
إشعار تم إيداع مبلغ في حساب الخاص بك يرجى المطالبة بها هنا خلال ساعة عبر رسالة الوسائط المتعددة,1
الاستغفار إزالة هم و تفريج غم وتكفير ذنب و اطمئنان قلب استغفر الله العظيم و اتوب إليه,0
عززي العمل الصراف الآلي الخاص بك محظور فا تصل ذا الرقم,1
المحك الحقيقي لأخلاقك سيتجلى عند غضبك و مدى تحكمك و سيطرتك على انفعالاتك فلا تغضب صباح الهدوء,0
خاص متقاعد ضاعف ثروت خلال شرن,1
رمز الأمان لعملية الشراء لمرة واحدة,0
نحن مهتمون بشراء منزلك نقدا كما هو بسعر أو أعلى من أي عرض صالح,1
لم نتمكن من معالجة فاتورتك الأخيرة لتجنب الرسوم قم بتحديث معلومات الفواتير الخاصة بك عبر,1
يوم جيد مطلوب مراجعة سريعة لتطبيقك المصرفي على,1
قيم الخدمات العامة وساهم في بناء الوطن حمل تطبيق وطني وشاركنا تقييمكصوت فاعل لوطن عامر وطني هو أحد مبادرات المركز الوطني لقياس أداء الأجهزة العامة أداء,0
تنبيه تطبيقات على هاتفك تنتهك دفاعاته الأمنية تأكد من سلامتك عن طريق حذف هذه البرامج,1
من م إشعار هام يرجى اتباع الرابط لمزيد من التفاصيل تابع من النهاية,1
شكرا لقد تم استلام رسالتك بنجاح,0
عميلنا العزيز الآن باقات كويك نت مسبقة الدفع أصبحت متاحة لعملاء سوا أحصل على بطاقات شحن كويك نت من أحد فروعنا أو من أحد الموزعين المعتمدين وإشترك بأحدى باقات كويك نت مسبقة الدفع من رقم جوال سوا لمعرفة معلومات أكثر عن باقات كويك نت تفضل بزيارة الرابط,0
يالله أوصيك بقلبها فأسعدها دوما احفظ تلك الروح الجميلة يارب وأرزقها الجنة املىء ثغرها بالفرحة وحقق أمنياتها اللهم لاتدع لها أمرا إلا يسرته ولا حلما إلا حققته ولا أمنية إلا أسعدتها بالعيش في جمال واقعها,0
أسعار التجوال الدولي في الأردن بالريال السعودي الاتصال المحلي الاتصال إلى السعودية الاتصال الدولي استقبال المكالمة الرسالة النصية البيانات لكل ميجابايت,0
بنك تم حظر الحساب بسبب محاولات احتيال مشبوهة انقر فوق لإعادة تنشيط الحساب,1
رصيدك تبي تستمتع بمكالمات لا محدودة من سوا أرسل الى,0
أسعار التجوال في تونسمكالمة محلية ريال للدقيقة مكالمة للسعودية ريال للدقيقة مكالمة دولية ريال للدقيقة استقبال المكالمات ريال للدقيقة إرسال الرسائل القصيرة ريال للرسالة الإنترنت ورسائل الوسائط ريال للميجابايت هذه بعض الأرقام الهامة التي قد تحتاج إليها خلال إقامتك في تونسسفارة المملكة الخطوط السعودية الملحقية الثقافية طوارئ السعوديين العناية بالعملاء مجاناولمزيد من المعلومات تواصل معنا مجانا على تطبيق مع ضرورة تسجيل جواز السفر للمواطنين السعوديين عبر الرابط التالي شحن خطك عن طريق تطبيق أو من خلال حسابك في أحد البنوك السعودية أو عن طريق خدمة حول لي عبر الخطوات ادناهبرسالة نصية إلى أرسل مسافة الرقم اللي تطلب منهمسافة المبلغ,0
حسابك على أمازون مقيد مؤقتا يرجى التأكيد لاستعادة الوصول قم بالرد ب لإلغاء الاشتراك,1
التقويم الدراسي بعد التعديلات الجديدة بتمديد إجازات منتصف العام للسنوات الثلاث القادمه أسبوعين,0
تم شحن رصيدك بنجاح ب ريالتنتهي صلاحية الخدمة في الآن تم إطلاق باقات سوا الجديدة مع كثير من المزايالمزيد من التفاصيل ارسل إلى,0
لا تشيل هم استهلاكك للبيانات واشترك في اللي يناسبك من باقات بيانات سوا الجديدة والمتنوعة يومي أسبوعي شهري وبحجم بيانات يبدأ من جيجا إلى لا محدودللمزيد عن باقات بيانات سوا ارسل إلى,0
خدمة التوصيل تقديم عنوان التسليم الصحيح لتجنب التأخير في استلام البضاعة بسبب عدم اكتمال رقم الباب بعد الرد ب موافق أعد تأكيد عنوانك يرجى تحديثه في الوقت المناسب افتح الرابط في المتصفح,1
أعرض لك خطة شاملة لسيارتك متاحة مقابل ريالا فقط في الشهر فتح رد النهاية لإلغاء الاشتراك,1
كلمة مرور لمرة واحدةرمزل الشراء من السوق الالكتروني تطبيق المباشر,0
تنبيه المطاردة لقد لاحظنا وجود أنشطة غير عادية في حسابك قم بزيارة للتحقق من الأنشطة قم بالرد ب على وقد يتم تطبيق أسعار البيانات,1
